job_title,job_category
"Har du lyst til at indgå i projektarbejde og udvikling af patientforløb i et kirurgisk sengeafsnit",16
"Amager og Hvidovre Hospital søger jordemødre",16
"Ortopædkirurgisk afdeling søger sygeplejerske med lyst til udvikling af akutte patientforløb i opnormeret sengeafsnit",16
"en dygtig sygeplejerske i et trygt og godt arbejdsmiljø, så er Gastro-medicinsk stedet for dig!",16
"Klinisk vejleder til Ortopædkirurgisk afdeling afsnit 212!",16
"Amager og Hvidovre Hospital søger lægesekretær til fødemodtagelsen/fødegangen",16
"Samordningskonsulent med sundhedsfaglig baggrund til Patientforløb på Amager og Hvidovre Hospital",16
"Lungemedicinsk Sengeafsnit søger sygeplejersker til semiintensiv funktion",16
"Timelønnet sygeplejerske eller social- og sundhedsassistent til Palliativ Enhed",16
"Laborant eller bioanalytiker med lyst til at arbejde med forskning i aldring og inflammation",16
"Sygeplejerske til akutte og spændende patientforløb",16
"Medarbejdere til Sterilcentralen i Serviceafdelingen på Amager- og Hvidovre Hospital",16
"Bioanalytiker til Klinisk Fysiologi og Nuklearmedicin, Hvidovre Hospital",16
"Sygeplejerske Børnemodtagelsen",16
"Aftenvagt, Social og Sundhedsassistent til Midlertidig Døgn Rehabilitering",16
"Social og Sundhedsassistent til Midlertidig Døgn Rehabilitering",16
"DiætistCentret søger klinisk diætist",16
"Handicaphjælper til korte lørdagsvagter",16
"Handicaphjælper søges til sommerferie-vikarstilling",16
"Handicaphjælper til barselsvikariat i Roskilde",16
"Handicaphjælper søges til fast stilling",16
"Handicaphjælper til barselsvikariat",16
"Team Ulstrup søger akutvikar til langtidssygdom og ferie",16
"Handicaphjælper søges i Brønderslev",16
"Hjælper søges til ung mand i Næstved",16
"Engageret hjælper søges til 6 døgnvagter om måneden",16
"Respiratorisk handicaphjælper deltid/fuldtid søges",16
"Nattevagtsafløser med erfaring fra ældreområdet søges til Plejecenter Strandmarkshaves ældreboliger",16
"Sundhedsservicesekretær / Sosu assistent med lægesekretær erfaring søges til gynækologisk klinik i Hvidovre og www.lilleliv.dk",16
"Handicaphjælper søges til job i Kerteminde- God løn tilbydes.",16
"Handicaphjælper søges til kvinde i Hinnerup ved Århus",16
"Handicaphjælper til mand i Kolding",16
"Handicaphjælper søges til mand i Odense",16
"Humørfuld og energisk handicaphjælper søges",16
"Handicaphjælper søges til kvinde i Vejle",16
"Handicaphjælper søges til et godt team hos kvinde ved Vejle",16
"Handicaphjælper søges til kvinde i Hinnerup ved Århus",16
"Handicaphjælper søges til 55-årig kvinde med CP ved Amager",16
"Akaciegården søger koordinerende terapeut til aktivitets- og træningsenhed",16
"Handicaphjælper søges til Allerød - Deltid.",16
"Laboratorietandtekniker eller klinisk tandtekniker til proteseafdeling.",16
"Social og sundhedsassistent eller Social og sundhedshjælper Barselsvikariat 35 timer",16
"Ønsker du udelukkende aftenvagter og er du social- og sundhedsassistent, så læs endelig videre",16
"Attraktiv stilling som sygeplejerske på vagtcentralen",16
"Sosu-assistent søges til Hjemmeplejen aftenvagt i Lyngby Taarbæk kommune",16
"Social- og sundhedsassistent til Plejecenter Virumgård",16
"Social- og sundheds assistent til Plejecenter Solgården",16
"Social- og sundhedsassistent til dagvagt",16
"Social- og sundhedshjælper til aftenvagt på demens afdeling",16
"Social- of sundhedsassistent til mindre afdeling.",16
"Barselsvikariat Vagtcentralen aftenvagt",16
"Kreativ og omsorgsfuld medarbejder",16
"Vikarer til to Bosteder i Lyngby-Taarbæk Kommune",16
"Engageret SSA med fokus på livskvalitet",16
"Social- og sundhedshjælper til Plejecenter Baunehøj, afdeling Rosen",16
"Udviklingssygeplejerske til Trænings- og Rehabiliteringscentret i Lyngby Taarbæk kommune",16
"Social-og sundhedsassistent/hjælper til nattevagt på Plejecenter Bredebo",16
"Social- og sundhedsassistent til Hjemmeplejen Baunehøj Lyngby Taarbæk kommune",16
"Ergoterapeut til psykisk og fysisk funktionsløft",16
"Dygtig og engageret social- og sundhedshjælper søges til vores dejlige plejehjem",16
"SSA'er (dag- og aftenvagt) til Møllegården Plejeboliger, afd. 2",16
"Social- og sundhedshjælpere til flyverkorpset - Gladsaxe Hjemmepleje",16
"Sommerafløsere til Hjemmeplejen i Gladsaxe",16
"Social- og sundhedshjælper søges til hjemmeplejen på Frederiksberg",16
"Sundhedsfaglig medarbejder søges til Kastanjehavens Plejeboliger",16
"Sundhedsplejersker søges til to faste stillinger, samt til vikariat",16
"PLEJEBOLIGERNE ØSTERVANG søger sygeplejerske",16
"Vi søger en ambitiøs sygeplejerskekollega til Hjemmesygeplejen i Frederiksberg Kommune",16
"Social- og sundhedshjælpere søges til aften- og dagvagt til Frederiksberg Kommune Hjemmeplejen",16
"Genopslag - Frederiksberg Kommunes Døgnrehabilitering (FKD) har brug for dig som sommerferievikar i dagvagt fra 15. maj 2021 eller snarest derefter til 1. september 2021",16
"Er du vores nye sårkoordinator",16
"Social- og sundhedsassistent søges til aftenvagt på Frederiksberg Kommunes Døgnrehabilitering",16
"Flintholm Plejeboliger på Frederiksberg søger nye kollegaer som social- og sundhedsassistent",16
"Genopslag - Akaciegården søger koordinerende terapeut til aktivitets- og træningsenhed",16
"Velfungerende kirurgisk operationsafsnit K (KOA) tilbyder sygeplejekollega velkommen til et afsnit med godt introduktionsprogram, kompetenceudvikling og godt arbejdsmiljø",16
"Akutmodtagelsen Bispebjerg søger lægesekretær, er det dig?",16
"Vagtgående bioanalytikere/industrilaboranter til Klinisk Biokemisk Afdeling, Bispebjerg og Frederiksberg Hospital",16
"Bioanalytiker/laborant/kemiker til LC-MS/MS på Klinisk Biokemisk Afdeling, Bispebjerg og Frederiksberg Hospital",16
"Få en god start på karrieren - Kirurgisk Sengeafsnit K1 på Bispebjerg Hospital søger kollegaer",16
"Vi søger social- og sundhedsassistenter som tilkaldevikarer til Ingeborggården/Nimbusparken",16
"Hjælper til pleje og hygge hos 12-årig dreng",16
"Deltid/studiejob til kvinde med CP i Ballerup SNAREST MULIGT",16
"Erfaren hjælper til 12-årig pige søges",16
"Handicaphjælper - Sommerferie vikariat - FULDTID",16
"4 dagvagter og 4 vågne nattevagter som hjælper i Hillerød",16
"Handicaphjælper til brødre med muskelsvind",16
"Respiratorisk hjælper til 3 vågne nattevagter pr.uge i Kastrup",16
"Aflaster søges til pige med ADHD og angst",16
"Kvindelig handicaphjælper søges til 1 års barselsvikariat",16
"Social- og sundhedsassistent til 12-årig pige.",16
"Hjælper/sekretær søges til ung studerende på DTU",16
"Aflaster søges til glad dreng på 4 år.",16
"Faglært/ufaglært hjælper til 9-årig dreng",16
"Respiratorisk handicaphjælper til 8 vågne nattevagter i Roskilde",16
"Respiratorisk handicaphjælper søges i Kbh.NV",16
"Respiratorisk handicaphjælper vikar fuldtid",16
"Faglært hjælper til dreng med multihandicap",16
"HJÆLPER SØGES – deltidsjob i mit hjem i Aabenraa.",16
"Hjælper til 51-årig mand med grøn stær",16
"Stilling som personlig hjælper",16
"Handicaphjælper til nattevagt søges. 24 timer om ugen",16
"Faglært/ufaglært hjælper til 14-årig dreng",16
"Kvindelig handicaphjælper søges",16
"Handicaphjælper til deltidsstilling, 15 timer/ugen",16
"Handicaphjælper søges, 36 timer i gennemsnit pr. uge",16
"Aflaster til 6-årig med autisme og ADHD",16
"Hjælper og aflaster til familie i Ølstykke",16
"8 x 12 timers dag og vågne nattevagter pr. mdr.",16
"Hjælper med autisme-erfaring søges",16
"7 timers hverdags dagvagter i Græsted",16
"Kvindelig hjælper til deltid i Ringe. SNAREST MULIGT!",16
"Hjælper på deltid til kvinde på Frederiksberg",16
"Hjælper, 25-30 t. i Jyllinge, snarest muligt :)",16
"Handicaphjælper - Sommerferie vikariat - FULDTID",16
"Social- og sundhedsassistent/hjælper søges til lille baby",16
"2 stk. respiratoriske dag/vågne nattevagter som hjælper i Hillerød",16
"3 primært dagvagter som respiratorisk hjælper i Hørsholm",16
"Moden og legeglad hjælper søges til 1-årig pige.",16
"Studiejob 3 eftermiddage pr.uge i Kastrup",16
"Handicaphjælper - Sommerferie vikariat - FULDTID",16
"Erfaren, fagligt engageret og selvstændig sygeplejerske søges til ungdomspsykiatrisk ambulatorium B195, Bispebjerg.",16
"Vagtgående bioanalytikere/industrilaboranter til Klinisk Biokemisk Afdeling, Bispebjerg og Frederiksberg Hospital",16
"Logistikmedarbejder til Forsyningsteamet på Bispebjerg og Frederiksberg Hospital",16
"Klinisk underviser til Dermato-Venerologisk afdeling og Videnscenter for Sårheling samt Endokrinologisk afdeling, Bispebjerg og Frederiksberg Hospital",16
Hygiejnesygeplejerske,16
"Brænder du for akut og kompleks sygepleje?",16
"Bioanalytiker/laborant/kemiker til LC-MS/MS på Klinisk Biokemisk Afdeling, Bispebjerg og Frederiksberg Hospital",16
"Til et 1-årigt vikariat søges en erfaren, fagligt engageret og selvstændig sygeplejerske til ungdomspsykiatrisk ambulatorium, Bispebjerg",16
"Akutmodtagelsen Bispebjerg søger lægesekretær, er det dig?",16
"Dagkirurgisk operationssygeplejerske søges til Idræts-, Ortopædkirurgisk Operationsafsnit MOA",16
"Til dig der vil videre: Hvad med intensivsygeplejerske?",16
"Få en god start på karrieren - Kirurgisk Sengeafsnit K1 på Bispebjerg Hospital søger kollegaer",16
"Tør du være ny i noget nyt? Fælles Intermediært Afsnit søger sygeplejersker med erfaring",16
"Social- og sundhedsassistent søges til Fælles Intermediært Afsnit",16
"Velfungerende kirurgisk operationsafsnit K (KOA) tilbyder sygeplejekollega velkommen til et afsnit med godt introduktionsprogram, kompetenceudvikling og godt arbejdsmiljø",16
"Engageret social- og sundhedsassistent til aftenvagt 28 timer/ugen på Kærbo",16
"Social- og sundhedsassistent til et sommerferievikariat primært i aftenvagt på Rundskuedagens plejecenter",16
"Social- og sundhedsassistent eller -hjælper til aftenvagt på Bispebjerghjemmet",16
"Den selvejende institution Johannesgården søger relationel stærk og empatisk SOSU-assistent i dagvagt til 3. sal",16
"Social- og sundhedsassistent til et sommerferievikariat primært i dagvagt på Rundskuedagens plejecenter",16
"VIP social- og sundhedshjælper til vikariat på Ørestad Plejecenter Team 3, profilplejecenter hvor kunst og kultur skaber livsglæde og fællesskab",16
"Social- og sundhedsassistent til aftenvagt på plejehjemmet Møllehuset",16
"Sygeplejerske til barselsvikariat på Sundholm",16
"Social- og sundhedsassistenter til Bispebjerghjemmet",16
"Fast social- og sundhedsassistent i dagvagt på Højdevang Sogns Plejehjem, Stueetagen",16
"Faste afløsere (social- og sundhedshjælpere/-assistenter) til Højdevang Sogns plejehjem i Valby",16
"Ansvarshavende aftenvagt til Huset William",16
"Sygeplejerskeafløsere med lyst til tilknytning på Fælledgården – landets største plejecenter",16
"Udviklingsminded social- og sundhedsassistent til Center for Demens - Lindehusene",16
"Sommerferievikarer søges til botilbud og i aflastningen på Jacobshøj",16
"Solgaven Valby søger social- og sundhedsassistent til dagvagt",16
"Fast social- og sundhedsassistent i aftenvagt på Højdevang Sogns Plejehjem",16
"VIP social- og sundhedsassistent til Ørestad Plejecenter Team 3, profilplejecenter hvor kunst og kultur skaber livsglæde og fællesskab",16
"Som social-og sundhedesassistent er du med til at løfte fagligheden i hjemmeplejen VBH",16
"Sygeplejerske eller social- og sundhedsassistent til dagvagt på Forchammersvej",16
"Psykomotorisk terapeut til Børnehuset GRO",16
"Det socialpsykiatriske botilbud Holme søger SOSU-assistent eller pædagog i et barselsvikariat",16
"Social- og sundhedsassistent til et godt job som aftenvagt på Rosenborgcentret",16
"Ergoterapeut som kontaktperson til Botilbuddet Røde Mellemvej (barselsvikariat)",16
"Dygtig social-og sundhedshjælper til Hjemmeplejen VBH",16
"Social- og sundhedsassistenter til Vikarkorpset i Sundheds- og Omsorgsforvaltningen",16
"Social- og sundhedspersonale til Ørestad Plejecenter (afløsere)",16
"Social- og sundhedsassistenter til aftenvagt i Aftenhjemmeplejen VKV",16
"Social- og sundhedshjælpere til Hjemmeplejen VKV",16
"Sundhedsfaglig konsulent til Center for Udsatte Voksne og Familier",16
"Pårørendevejleder med sygeplejefaglige kompetencer til Områdekontor Nord",16
"Faste weekendafløsere og timelønnede med sundhedsfaglig baggrund til Kastanjehusene",16
"Koordinerende social- og sundhedsassistent til aftenvagten i Hjemmeplejen VKV",16
"To omsorgs- og pædagogmedhjælpere til Botilbuddet Jakobshøj",16
"Sundhedsfaglige medarbejdere til ferieafløsning og som tilkaldevikarer på Verdishave",16
"Profilplejecentret Bonderupgård med "dyr og udeliv" som profil søger social- og sundhedsassistent til aftenvagt",16
"Sygeplejersker til dagvagt i Møllehuset",16
"Sygeplejersker søges til visitation af sygepleje i Den Sociale Hjemmepleje i København NV",16
"Vågen nattevagt til botilbuddet Jacobshøj – vikariat (6 mdr.) med mulighed for forlængelse",16
"Plejecenteret Kærbo søger afløsere (social- og sundhedsassistenter, -hjælpere og sygeplejersker) til dag- og aftenvagter − du skal også kunne arbejde i sommerperioden",16
"Social- og sundhedsassistent til Frelsens Hærs plejecenter Aftensol",16
"Nattevagt til Huset William",16
"Social- og sundhedshjælper i dagvagt på Højdevang Sogns Plejehjem, Stueetagen",16
"Synskonsulent til hjernerystelsesområdet til Center for Specialundervisning for Voksne",16
"Social- og sundhedsassistent i dagvagt til Klarahus",16
"Dygtig og engageret sygeplejerske til plejecentret Verdishave",16
"Social- og sundhedsassistent til dagvagt 35-37 timer til Haandværkerforeningens Plejehjem",16
"Sygeplejerske til nattevagt på Sundheds- og Omsorgsforvaltningens vagtcentral",16
"Lokalområde Vesterbro/Kgs. Enghave/Valby søger sygeplejerske med interesse for rehabilitering og tværfaglighed",16
"Social- og sundhedsassistenter til faste aftenvagtsstillinger i Hjemmeplejen Indre By/Østerbro",16
"Sundhedsfaglig konsulent med sygeplejefaglig baggrund til Områdekontor Nord, Københavns Kommune",16
"SOSU-assistent eller sygeplejerske søges til Rusmiddelbehandling Prags Boulevard",16
"Social- og sundhedsassistent til aftenvagt på Rehabiliteringscenter i Valby",16
"Timelønnet social- og sundhedsassistent til Aftensol",16
"Social- og sundhedsassistent til dagvagt i Verdishave",16
"Sygeplejerske til Plejecentret Aftensol",16
"Sygeplejerske til Botilbuddet Sundbygårdsvej, Center for Specialiserede Botilbud",16
"Social- og sundhedshjælpere til Vikarkorpset i Sundheds- og Omsorgsforvaltningen",16
"Sundhedsfagligt personale søges til Viben – et bosted for hjerneskadede",16
"Social- og sundhedsassistenter til Møllehuset",16
"Dygtige social- og sundhedshjælpere/-assistenter til ferievikariater eller timelønnede stillinger i Hjemmeplejen Vanløse/Brønshøj/Husum",16
"Social- og sundhedshjælper til aftenvagt i Huset William",16
"Sundhedsfaglige afløsere til dagvagt med mulighed for vikariat i Langgadehus",16
"Sygeplejersker til Center for Rehabilitering og Akutpleje − Bystævneparken",16
"Erfaren gruppeleder til Hjemmesygeplejen Indre By/Østerbro",16
"Center for Udsatte Voksne og Familier søger ansvarshavende nattevagt til E-Huset",16
"Social- og sundhedshjælpere til aftenplejen i hjemmeplejen Bispebjerg/Nørrebro",16
"Hjortespring søger SOSU-assistent eller SOSU-hjælper til aftenvagt",16
"Kontaktperson i socialpsykiatrien til attraktiv stilling på Fogedgården",16
"Aftenhjemmeplejen Indre By/Østerbro søger social- og sundhedshjælper",16
"Sommerferievikarer til projekt om fremtidens ældrepleje hos Guldbergs Have",16
"Fysioterapeut til Geriatrisk team på Center for Genoptræning Nørrebro",16
"Timelønnede sygeplejersker til Valmuen, Specialenhed for Lægeordineret Heroinbehandling",16
"Social- og sundhedshjælpere/-assistenter som faste weekend- og ferieafløsere på Haandværkerforeningens Plejehjem og MPO-pladser i Emdrup",16
"Social- og sundhedsassistent som koordinerende aftenvagt på Bispebjerghjemmet",16
"Dygtig social- og sundhedshjælper til Hjemmeplejen Amager",16
"Studiejob på Klarahus",16
"Social- og sundhedsassistent til fast aftenvagt på Rundskuedagens plejecenter",16
"Social- og sundhedsassistenter til faste stillinger i Hjemmeplejen Indre By/Østerbro",16
"Sygeplejerske (barselsvikariat) søges til Rundskuedagens Plejecenter midt på Vesterbro",16
"Social- og sundhedsassistent til et godt job som dagvagt på Rosenborgcentret",16
"Plejecenteret Kærbo søger uuddannede afløsere med hjertet på rette sted og gerne erfaring til dag-, aften- og weekendvagter − du skal også kunne arbejde i sommerperioden",16
"Sommerferievikarer med sundhedsfaglig baggrund til Hjemmeplejen Bispebjerg/Nørrebro",16
"Ansvarshavende social- og sundhedsassistent til aftenvagt på plejecentret Sølund – et plejehjem med musikken i centrum",16
"Fysioterapeut til Kiro-fys.dk Frederiksberg",16
"Sygeplejersker til arbejde i privat hjem søges!",16
"Studerende, fleksjobber eller anden person med interesse for et morgenjob hos ung handicappet mand søges 10 timer / ugen.",16
"SUNDHEDSFAGLIGT AFLASTNINGSPERSONALE SØGES",16
"DELTIDSSTILLING SOM HANDICAPHJÆLPER SØGES TIL 14 ÅRIG DRENG I REBILD",16
"DELTIDSHANDICAPHJÆLPER SØGES TIL UNG PIGE I HORSENS",16
"DELTIDSSTILLING SOM HANDICAPHJÆLPER SØGES TIL 6 ÅRIG PIGE I SØNDERBORG",16
"Tidsbegrænset stilling som laborant",16
"Kosmetolog/kosmetiker søges til hudplejeklinik på Nørrebro",16
"Humørfyldt mand bosiddende i Kastrup søger ny hjælper",16
"Handicaphjælper søges til sommerferie-vikarstilling",16
A-TEAM,16
"Er du SSA og kan li’ sygeplejefaglige udfordringer?",16
A,16
"Sygeplejerske med stedfortræder funktion søges til Margarethagården",16
"Sygeplejerske til nattevagt i Helsingør",16
"Alletiders kollegaer holder snart sommerferie",16
"Sygeplejen i Helsingør Kommune søger en engageret sygeplejerske",16
"Barselsvikar for klinikassistent",16
"Practio søger vaccinatører til COVID-19 vaccinationsklinikker i Tønder",16
"Practio søger assistenter til COVID-19 vaccinationsklinikker i Tønder",16
"Practio søger personale til COVID-19 vaccinationsklinikker",16
"Practio søger personale til COVID-19 vaccinationsklinikker",16
"Laborant til fuldtidstilling hos AGC i Søborg (UPSTREAM TECHNICIAN)",16
"Medarbejdere til laboratorieanalyse",16
"Nyuddannet sygeplejerske. Vi vil have dig",16
"En Fysioterapeut til den medicinske gruppe, Herlev og Gentofte Hospital – Gentofte matriklen",16
"Medarbejdere til COVID-19 vaccination",16
"Afdelingen for Mave-, tarm og leversygdomme, afsnit 3, søger kirurgisk sygeplejerske",16
"Ønsker Du; Faglig Udvikling, Stærkt Sammenhold, og Bred Sygepleje!",16
"Banker dit hjerte for at løfte i flok?",16
Sygeplejerske,16
"I Lungesygdomme, Klinik 2 på Gentofte Hospital opnormerer vi og søger derfor to sygeplejersker",16
"Sygeplejerske søges- til afdelingen for urinvejssygdomme afsnit 2, Herlev Hospital.",16
"Sygeplejerske søges til et helt særligt afsnit",16
"Operationsmodtagelsen og opvågningen på Herlev/Gentofte hospital søger sygeplejerske til Gentofte matriklen",16
"Operationsmodtagelsen og opvågningen på Herlev/Gentofte hospital søger sygeplejerske til Gentofte matriklen",16
"Sygeplejerske til Gentofte Akutklinik",16
"Ja, dig som er erfaren sygeplejerske og kunne tænke dig noget nyt",16
"Nyuddannet sygeplejerske til mave-tarm- og leversygdomme, elektivt kirurgisk afsnit 3.",16
"Massage therapist for weekends and more",16
"Aftenvagt (SSH) til vores Helsingør team",16
"Vil du godt på vej (videre?) i din sygepleje i Helsingør?",16
"Tandplejer til Tandregulerings klinikken i Helsingør Kommune",16
"SSA på HRT? Du ville ønske du var en af os!",16
"Omsorg og pleje til dement mand i eget hjem",16
"Skovsminde søger SOSU-assistent til nattevagt, pleje og omsorg",16
"Massør / Zoneterapeut / Akupunktør søges til tværfaglig kiropraktor klinik i København",16
"Jordemoder / Ammevejleder søges til tværfaglig kiropraktor klinik i København",16
"Negletekniker søges",16
"Gør en forskel og bliv ferie- og weekendafløser i Hjemmeplejen!",16
"Vågen nattevagt 20 timer ugentlig og nattevagtsvikar søges til Boligerne ved Grønningen",16
"Social- og sundhedshjælper med humor og masser af engagement søges til dagvagt i hjemmeplejen",16
"Er du uddannet social og sundhedshjælper og trives bedst med at arbejde om aftenen? Barselsvikariat - genopslag",16
"Afløsere søges til Jægersborghave",16
"Blomsterhusene søger SOSU-assistenter til fast weekend",16
"Gruppeleder med uddannelse som social- og sundhedsassistent eller sygeplejerske søges til aftenvagt",16
Standard,16
"Sundhedsfaglige medarbejdere søges til Egebjerg, Gentofte Kommune",16
"Ambitiøs udviklingsfysioterapeut søges til Tranehaven, Gentofte Kommunes Center for forebyggelse og rehabilitering.",16
"Er du social- og sundhedsassistent og vil du gerne arbejde på Egebjerg i Gentofte Kommune",16
"Social- og sundhedsassistent eller social-og sundhedshjælper i nattevagt",16
"social og sundhedsassistent til Ordruplund aftenvagt.",16
"Er du uddannet social og sundhedshjælper og trives bedst med at arbejde om aftenen? Vikariat",16
"Timelønnede medarbejdere i weekend og helligdage samt ferieafløsning søges til Rygårdcentret",16
"Helhedstilbuddet Blindenetværket søger nattevagt til 30-timers stilling",16
"Fysioterapeut til hjemmebehandlinger i Hillerød",16
"Hårklinik søger sygeplejerske/behandler",16
"Sygeplejersker/SOSU-assistenter afløser ansvarshavende",16
"SOSU-assistent dagvagt",16
"SOSU-hjælper aftenvagt",16
Sygeplejerske,16
"Studiejob til sundhedsfaget",16
"SOSU-assistent aftenvagt",16
"Plejehjemmet Birkebo søger engagerede social- og sundhedshjælpere",16
"Vi søger ansvarshavende sundhedsfaglig (social- og sundhedsassistent) til aftener på OK-Fonden Arendse",16
"Bioanalytikere til Klinisk Immunologisk Afdeling, Blodbanken på Rigshospitalet",16
"Bioanalytiker til IHC+ teamet til Patologiafdelingen, Rigshospitalet",16
"Ambitiøst og højt specialiseret semi-intensivt afsnit søger sygeplejerske pr. 1. juli 2021 eller efter aftale",16
"Sygeplejerske til CPAP-behandling i Dansk Center for Søvnsygdomme",16
"Kompetent lægesekretær søges til receptionen i Afdeling for Hjerne- og Nerveundersøgelser, Rigshospitalet - Glostrup",16
"BørneUngeAfdelingen søger Klinisk Sygeplejespecialist til afsnit for Stamcelletransplantation",16
"Hjertekirurgisk iskæmisk afsnit 3061 søger ny kollega",16
"Ønsker du spændende opgaver og en afvekslende hverdag, så læs videre her",16
"Jordemødre søges til 5 faste stillinger på fødeafdelingen, Obstetrisk Afdeling, Rigshospitalet",16
"Velkommen til afdeling 2043 - Afdelingen for nye og erfarne sygeplejersker som søger en varieret hverdag inden for det urologiske speciale",16
"Bioanalytiker til Afdeling for Vækst og Reproduktion",16
"Anæstesisygeplejerske til spændende afdeling",16
"Rigshospitalet Neurocentret, Afdeling for Bedøvelse og Intensiv Behandling",16
"Sygeplejerske til ambulatoriet i Afdeling for Nyresygdomme",16
"4 neurologi-interesserede medicinstuderende søges til 1-årigt forskningsår på Dansk Hovedpinecenter med start 1. august.",16
"Klinisk underviser i fysioterapi til Team for klinisk vejledning og undervisning",16
"Klinisk sygeplejespecialist der har lyst til at præge et nyt intensivt afsnit for patienter fra botilbud",16
"Erfaren Opvågningssygeplejerske til Afsnit for Operationsmodtagelse og Opvågning i HovedOrtoCentret på Rigshospitalet",16
"Er du social- og sundhedsassistent? Vil du have indflydelse? Og vil du præge et nyt intensivt afsnit for patienter fra botilbud?",16
"Sygeplejerske/social- og sundhedsassistent som fast nattevagt til intensivt afsnit på Psykiatrisk Center København, Rigshospitalet",16
"Social- og sundhedsassistent som fast nattevagt på C270V",16
"Vi opnormerer og søger nu 4 ansvarshavende aftensygeplejersker med trissefunktion",16
"Chancen for at få din drømmestilling på Psykiatrisk Center København er der nu. Vi søger flere dygtige uddannede lægesekretærer!",16
"Hjerteklapsygeplejerske – unik mulighed på Rigshospitalet",16
"Patientkoordinator til BørneUngeAfdelingens ambulatorie for leversygdomme (GENOPSLAG)",16
"Afdeling for Røntgen og Skanning samt Afdeling for Hjertesygdomme søger radiograf",16
"Underviser søges til Afdeling for Klinisk Fysiologi, Nuklearmedicin & PET Rigshospitalet",16
"Sygeplejersker pr 1.6.21 eller snarest muligt herefter til dagafsnittet i BørneUngeAfdelingen på Rigshospitalet",16
"Bioanalytiker/Radiograf med lyst til patientkontakt",16
"Afdeling for Røntgen og Skanning, Rigshospitalet Blegdamsvej søger MR-radiograf.",16
"Dygtig lægesekretær søges til Afdeling for Hjerne- og Nervesygdomme, Rigshospitalet – Glostrup",16
"Sygeplejerske til vikariat på psykiatrisk ambulatorium Bispebjerg/Brønshøj",16
"Rigshospitalet søger Digitaliserings- og udviklingskonsulent",16
"Rigshospitalets mest spændende sengeafsnit søger ny sekretærkollega",16
"Engagerede sygeplejersker søges til spændende speciale med udfordringer og gevinster på infektionsmedicinsk afdeling 8642, Rigshospitalet",16
"Vil du ”være god til blod?”- så søg job i vores nye fælles Afdeling for Blodsygdomme på Rigshospitalet",16
"Afdeling for Blodsygdomme på Rigshospitalet søger sygeplejerskekollegaer, der vil ”være god til blod” med ansættelsesstart i ambulatoriet på Herlev Hospital",16
"Jordemoder eller sygeplejerske til et barselsvikariat - sårbart team, Obstetrisk Afdeling",16
"Trives du med at arbejde om natten, og vil du gøre en forskel for den psykiatriske patient på C270V?",16
"Engageret og fagligt dygtig sygeplejerske til affektivt sengeafsnit 6111",16
"Vil du arbejde med kirurgisk sygepleje i både ambulatorium og sengeafdeling, så se her!",16
