job_title,job_category
"Agerbækhuse søger en dygtig afdelingsleder til Aktivitetscentret Blumesvej",9
"Pædagogisk konsulent til Dagtilbudsafdelingen",9
"Morgenåbner til Søndre skoles SFO",9
"Fogedgården søger nysgerrig og naturinteresseret PAU/ pædagogmedhjælper",9
"Selvstændig og kompetent udgående koordinator med kendskab til unge mellem 16-21 år søges.",9
"Pædagog til Møn Skole, Stege afdeling",9
"Skovvang Børnehus søger faglig teamkoordinator og pædagog med interesse for natur                  og udeliv til vores børnehave",9
"Børnehuset Stribonitten søger en Pædagog",9
"Ressourcepædagog til 0-5 års området",9
Dagplejepædagog,9
"Pædagog til indslusningsgruppe",9
"To pædagoger til den bedste personalegruppe, der findes",9
"Genopslag - dagplejer til Dagplejen i Ballerup Kommune",9
"Socialrådgiver til barselsvikariat i Familieafsnit.",9
"Dagplejere søges.",9
"Dygtig pædagog søges",9
"Pædagoger til Børnehuset Himmel og Hav",9
"til Lunden en pædagog, psykomotorisk terapeut eller ergoterapeut med kompetencer indenfor psykiatri og misbrugsbehandling, i socialpsykiatrisk botilbud.",9
"Social- eller sundhedsfaglige medarbejdere til dobbeltdiagnosebehandling til dag/nat stilling med tilknytning til et af Lundens tre behandlingsteam.",9
"Pædagog til Weekendkolonien hver anden weekend",9
"Pædagog til Ældrecentret Nygårds Plads - Brøndby",9
"Fagligt stærk og robust socialpædagog 30-37 timer/ugentligt til Enghusene",9
"SSP-koordinator i Brøndby Kommune 37 timer",9
"Pædagog til gruppeordning",9
"Pædagoger søges til Bofællesskabet Holmelunden",9
"Vikarer til Aris Krisecenter",9
"Vi har fanget Danmarks sødeste børn - kom og leg med os!",9
"Uddannet pædagog 37 timer",9
"Frisk og omsorgsfuld pædagogmedhjælper søges",9
"Tryllefløjten - et eventyr for børn og voksne",9
"Pædagog til fast stilling i vuggestuen",9
"Tangloppe søger pædagogmedhjælper",9
"Pædagog? Vi glæder os til at møde dig?",9
"Saxoly Børnehus søger 2 pædagoger til vores vuggestue",9
"Barselsvikariat Pædagog til institution med udflytterafdeling, 37 timer.",9
"Vuggestuepædagog til den selvejende institution Guldberg-Hudegården på Nørrebro",9
"Pædagog til hyggelig vuggestue søges",9
"Den private natur og udelivs institution Stauninggården søger uddannede pædagoger",9
"Børnehuset Fælleden søger dygtig medhjælper",9
"Vi søger 2 fagligt dygtige pædagoger til vuggestueafdelingen samt en pædagog til barselsvikariat",9
"Pædagogisk assistent eller lignende søges som vikar til pædagogisk arbejde på opholdssted/botilbud",9
"Pædagog søges til de farvede huse på Plejecenter Snorrebakken",9
"Pædagog med koordinatorfunktion til SFO Frito, Søndermarksskolen",9
"Engageret pædagog til Svartingedal SFO (30 timer)",9
"2 Socialpædagoger søges til STU afd. Sveasvej",9
"Socialpædagoger til Ungehuset",9
"Socialrådgiver - Lindehuset,",9
"Gravermedhjælper til Harboøre kirkegård",9
"Erfaren pædagog/pædagogmedhjælper indenfor ”voksen, handicap og psykiatri-området” søges",9
"Skolepædagog/pædagogmedhjælper/flex-jobber til Blåbjergskolen, afd. Outrup",9
"Socialfaglig medarbejder til Esbjerg Forsorgshjem",9
"Pædagogmedhjælper til Solstrålen i Tarm",9
"Gravermedhjælper ved Horne Kirkegård",9
"Genopslag - Pædagog til barselsvikariat i Klatretræet",9
"Sct. Jacobi Skole og - Dagtilbud - Ny Specialskole i Varde Kommune søger 4 dygtige specialpædagoger fra 1/8 2021 til faste stillinger 37 timer",9
"Sct. Jacobi Skole og - Dagtilbud - Ny Specialskole i Varde Kommune søger tre pædagogiske assistenter fra 1/8 2021, faste stillinger 37 timer",9
"”Støttepædagog” til Møllehuset",9
"Bliv dagplejer i Oksbøl, Janderup og Billum",9
"Pædagog søges hurtigst muligt til midlertidig stilling i Outrup Børnehaven",9
"Bliv dagplejer i Næsbjerg",9
"Bliv dagplejer i Skovlund/Ansager",9
"Center Bakkehuset søger pædagogisk og sundhedsfaglig personale",9
"Pædagog til Område Koglehuset",9
"Terapi- handicap ansvarlig søges.",9
"Socialrådgivningen søger socialrådgiver til Anbringelses- og Hjemgivelsesteamet - genopslag",9
"Dagplejer til Borris, barselsvikariat",9
"Dagplejere til Sennels, Hanstholm, Østre, Tingstrup og Rolighed",9
"Tilkaldevikar til Bofællesskabet Auktionsvej",9
"Pædagogisk medarbejder til Team Bostøtte",9
"Pædagog - 37 timer",9
"Fribørnehuset Ø. Jølby søger pædagogmedhjælper",9
Pædagogmedhjælper,9
"Medarbejder med pædagogisk eller sundhedsfaglig baggrund til Opholdsstedet Jupiter",9
"Jacob A Riis børnehave",9
"Vikarer til bo- og døgntilbudsområdet – også en jobmulighed med mening til sabbatåret eller som studiejob",9
"Vædderbos Børne- og Familiehus søger uddannet pædagog med erfaring indenfor familiebehandling",9
"Dagplejerne i Tønder By søger ny kollega",9
Støttepædagog,9
"Uddannet pædagog til specialundervisningscenter",9
"Uddannet pædagog",9
"Ressourcepædagog med faglig viden og indsigt i arbejdet med børn i udsatte positioner til Dagtilbud Område Løgumkloster og Toftlund,",9
"Für die Abteilung Deutscher Kindergarten Lügumkloster suchen wir zum 01.06.21 eine Abteilungsleitung m/w/d mit 37 Wochenstunden",9
"Deutscher Kindergarten Jeising einer Schwangerschaftsvertretung",9
"Pædagog eller pædagogisk assistent til AutismeCenter Skive",9
"Er du den vi søger til en fast stilling i Handicap og Psykiatri, Voksen teamet som socialrådgiver??",9
"Pædagog i Vestervang",9
"PRIVAT PASSER / UNG I HUSET",9
"Fagligt dygtige og engagerede pædagoger med hjertet på rette sted til Toftlund Børnehave",9
"Faglig koordinator",9
"Pædagog i barselsvikariat",9
"Pædagog - barselsvikariat",9
Pædagog,9
"Pædagogmedhjælper - barselsvikariat",9
"Vikarer Bo- og beskæftigelsescentret Vejen – Nørregadehus 75",9
"Jobrådgiver Team Unge - barselsvikariat, 34 timer",9
"Engagerede og fleksible vikarer søges!",9
"Miljøbehandler til vores afdeling i Vojens",9
Socialpædagog,9
"Løgstrup Skole søger skolepædagog - barselvikariat på 35 timer",9
"Pædagogmedhjælper til Daginstitutionerne i Kjellerup-Levring",9
"Pædagogmedhjælper til vikariat på Bellisbo",9
"Dagplejere i Ikast",9
"Pædagog til døgnarbejde på Fårupgård Ungecenter, afdeling Godset",9
"Overlund Skole og SFO søger en skolepædagog til et barselsvikariat",9
"Timelønnede vikarer til B og U Handicap Viborg",9
"Pædagog og aktivitetsmedarbejder",9
"Sagsbehandler (barselsvikariat)",9
"Fagspecialist - genopslag",9
"Pædagoger til Fjordskolen",9
"Pædagogmedhjælpere til Fjordskolen",9
"Pædagog til Bostøtten i Autismecenter Syd",9
"Vikarer til Børnehuset Lille Kolstrup - Børnehandicapområdet",9
"Socialrådgiver søges til Møgelkær/Nr. Snede Fængsel",9
"Pædagoger til Skibet Børnehus",9
"Gardinmontør med flair for godt håndværk",10
"Symagipigerne i Herfølge søger snarest muligt en syerske til et lille team på 7.",10
"Produktionsmedarbejder til systue (Faststilling)",10
"Rutineret syerske til hyndeproduktion",10
"Forbrugerklagenævnet søger sagkyndige til området for tekstil, skind og rens",10
"Horsens Polstring A/S søger møbelpolstrer",10
"Brands4kids har vokseværk og søger en konstruktør til vores afdeling i Aalborg",10
"Vi har vokseværk og søger en konstruktør hos Brands4kids i Aalborg",10
"Gardinmontør - sælger søges til Nordjylland",10
"Engageret Møbelpolstrer Søges",10
"Engageret Syerske Søges",10
"Møbelsælger, deltid, Glostrup",10
"Udby Skole søger lærer samt barselsvikar",11
"HF-underviser til Nordvestsjællands HF og VUC",11
"Ellebækskolen søger lærer til specialafdelingen",11
"Integrationsgruppen søger tværfaglig og resultatorienteret underviser til jobsøgningsindsatsen",11
"Erfaren og analytisk økonomikonsulent til Børn- og Ungeområdet i Center for Koncernservice",11
"Hørekonsulent søges til Videnscenter for Specialpædagogik – ViSP i Næstved",11
"Ellebækskolen søger lærer til undervisnings- og behandlingstilbud",11
"Faglærer til Struktøruddannelsen",11
"ZBC Digitalt Læringscenter søger undervisere med tiltrædelse senest 1. august 2021",11
"Musik- og matematiklærer med stærke relationskompetencer",11
"Lundby Efterskole søger lærer til fuldtidsstilling.",11
"Hf-underviser til psykologi C",11
"Lærer søges til Gåsetårnskolen i Vordingborg Kommune",11
"Gåsetårnskolen søger en børnehaveklasseleder",11
"Lærer søges til Gåsetårnskolen, afdeling Ørslev i Vordingborg Kommune",11
"Dygtige lærerkollegaer til vores udskoling til Fjordlandsskolen",11
"Lærere til Melby Skole pr. 1. august 2021",11
"Ølsted Skole søger flere lærere til indskoling og mellemtrin",11
"2 Virksomhedskonsulenter søges til en forstærket virksomhedsrettet indsats i Halsnæs Kommune.",11
"Musiklærer til Melby Skole pr. 1. august 2021",11
"Underviser til Aqua-fitness/ bevægelse i vand i Haslev",11
"Fonden Fællesskolen søger en lærer",11
"Dygtig og passioneret engelsklærer til undervisning af voksne.",11
"Roskilde Kommune søger virksomhedskonsulent til det tværfaglige beskæftigelsestilbud – Fønix",11
"Fagligt velfunderede og engagerede lærere til Ådalens Skole",11
"Tilkaldevikar søges til Klub Roskilde Øst",11
"Matematiklærer samt kulturfagslærer til Sankt Helene Skole",11
"Lærer til dansk i indskolingen",11
"Dansk-, engelsk- og PASE-lærer med stærke relationskompetencer søges",11
"Matematik- og naturfagslærer med stærke relationskompetencer søges",11
"Deltidslærer til Møn Skole, Fanefjord afdeling",11
"Lærer med fysik/kemi og matematik til specialklasser på Fløng Skol",11
"Sagsbehandler til det specialiserede voksenområde",11
"Jobcoach til Jobcentrets Aktive Tilbud i Greve",11
"Lærer (barselsvikariat) til Bækkegårdsskolen, Distriktsskole Stenløse",11
"Lærer til læseklasse med viden om ordblindhed pr. den 1.8.2021",11
"Lærer (barselsvikariat) med fokus på inklusionsindsatsen til Bækkegårdsskolen, Distriktsskole Stenløse",11
"Lærkeskolen søger tre-fem lærere samt to barselsvikarer pr. 1.8.2021",11
"Musiklærer til Bækkegårdsskolen – et dejligt sted at være",11
"Indskolingslærer til matematik, musik og natur/teknologi på Ganløse Skole",11
"Distriktsskole Smørum, afdeling Boesagerskolen, søger en engageret dansklærer til kommende 1.klasse",11
"Bækkegårdsskolen søger to barselsvikarer fra 1. august",11
"Lærer til læseklasse med viden om ordblindhed pr. 1.8.2021",11
"Lærere søges til Reerslev Skoles landsbyordning pr. 01.08.21",11
"Jobkonsulenter med trippel-rolle til ”Bevægelse til arbejde"",11
"Pædagogisk vejleder til Harløse Skole pr. 1. august 2021",11
"Drømmestilling for den ambitiøse læsevejleder eller læsekonsulent",11
"To lærere (37 timer) til Harløse Skole pr. 1. august 2021",11
"Instruktør til skolepraktikværkstedet for maler- og mureruddannelserne",11
"Konsulent til Praktikcenteret",11
"Strøbyskolen søger lærer til specialgrupper og matematik i indskoling(barselsvikariat)",11
"Lærere til Fønix, skole- og dagbehandlingstilbud",11
"Erfaren lærer til indskolingen på Farum Lilleskole",11
"Er du vild med indskoling? Lærer søges til Vejlebroskolen",11
"Herstedøster Skole søger 1 lærer og 1 barselsvikar til udskolingen! Skal det være dig?",11
"2 engagerede og dygtige dansklærere til Herstedøster Skole!",11
"Vi søger to lærere til specialklasserækken",11
"Vi søger dansklærer til indskolingen",11
"SOSU H søger underviser med fagansvar til vores Portøruddannelse i Kursuscentret",11
"SOSU H søger underviser til vores kursuscenter",11
"Faglig leder til Gl. Hjortespringskole",11
"Engageret speciallærer til tidsbegrænset stilling på Bakkeskolen",11
"Faglig leder for gruppeordningen for elever med generelle indlæringsvanskeligheder på Skovbrynet Skole",11
"Naturfagslærer til Center for børn og unge med særlige udfordringer",11
"Engagerede og udviklingsorienterede lærere og barselsvikar til indskoling/mellemtrin på Birkerød Skole",11
"Engagerede og fagligt stærke Lærere til Mørkhøj Skole",11
"Underviser til Jobsnuseren - sociale medier (8 forløb à 1 uge)",11
"Dansk på 4. årgang og vejleder",11
"Afdelingen for Beskæftigelsesafklaring og Fleksjob, Hvidovre Jobcenter, søger to medarbejdere til projektstillinger",11
"Dansk (musik) 1. årgang",11
"Vi søger en pædagogikumkandidat i matematik",11
"Lærere til Langebjergskolen i Humlebæk",11
"Faglærer med kendskab til procesindustrien",11
"LKT Lærer til Engelsborgskolen",11
"Dansk-Musik- H/D lærer mellemtrinnet til Engelsborgskolen",11
"Lærer for elever med ordblindhed i Lyngby-Taarbæk Kommune",11
"Lærer til Trongårdsskolen",11
"Lærer til barselsvikariat på Trongårdsskolen 1. august",11
"Dansk og idrætslærer barselsvikariat til Engelsborgskolen",11
"Undervisere til progressive uddannelser (digital design og webudvikling)",11
"Undervisere til progressive IT-uddannelser (programmering, systemudvikling og back-end)",11
"Omsorgsfuld medhjælper søges til personlig assistance",11
"Skarp på matematik og natur/teknologi, så læs med her!",11
"VVS’er til undervisning på hovedforløb på TEC",11
"Elektrikere til undervisning på grund- og hovedforløb på TEC",11
"Støtteperson/mentor søges til 27-årig mandlig studerende.",11
"Ambitiøs, motiverende og imødekommende afdelingsleder til Kildevældsskolen",11
"Sortedamskolen søger dansklærer til udskolingen",11
"Lærer til Blågård Skole (barselsvikariat)",11
"Amager Fælled Skole indskoling/mellemtrin søger læsevejleder og fire nye lærere",11
"Vigerslev Allés Skole søger naturfagslærer",11
"Modersmålslærer i italiensk til Modersmålsskolen i København",11
"Modersmålslærer i svensk til Modersmålsskolen i København",11
"Dansklærer til 9. årgang på Brønshøj Skole (barselsvikariat)",11
"Tre lærere til Lergravsparkens Skole (barselsvikariater)",11
"Erfaren specialskolelærer til Kildevældsskolens specialafdeling",11
"Jobkonsulent til tilbud for borgere med sproglige barrierer i Jobcenter København (barselsvikariat)",11
"Lærer til fast stilling i teambaseret udskoling på Utterslev Skole",11
"Lærere til barselsvikariater på Skolen på Islands Brygge",11
"Nysgerrig og passioneret matematiklærer til børnelæringsmiljøet på Tagensbo Skole (barselsvikariat)",11
"Valby Skole søger lærere til faste stillinger og barselsvikariater til skoleåret 2021-22",11
"Matematiklærer til 0.-5. årgang på Tagensbo Skole",11
"Tre lærere til fastansættelse på Guldberg Skole",11
"Matematiklærer (udskoling) til Solbakken dagbehandlingsskole",11
"To lærere med linjefag i matematik til Utterslev Skole",11
"Lærere med engagement og faglige ambitioner i et specialiseret felt søges til Øresundsskolen",11
"Lærer til folkeskoleafdelingen på Sankt Annæ Gymnasium",11
"Ungdomsskolen søger undervisere til Byhøjskolen",11
"Tre lærere til fuldtidsstillinger på Strandparkskolen",11
"Modersmålslærer i kinesisk til Modersmålsskolen i København",11
"Beskæftigelseskonsulenter til Karrierecentret i Jobcenter København",11
"Dansklærer til 6. årgang på Brønshøj Skole (barselsvikariat)",11
"Afdelingsleder for udskolingen på Husum Skole",11
"Fem lærere til Amager Fælled Skoles mellemtrin/udskoling",11
"Fagligt ambitiøs afdelingsleder til indskoling på Peder Lykke Skolen",11
"Brønshøj Skole søger en matematiklærer til kommende 3. årgang i et barselsvikariat",11
"Beskæftigelseskonsulenter til Jobcenter København – Karrierecentret",11
"Lærer til udskolingen på Katrinedals Skole (barselsvikariat)",11
"Lærer i matematik på mellemtrinnet til Sortedamskolen",11
"Indskolingslærere til dansk og matematik på Grøndalsvængets Skole",11
"Lærere til Kalvebod Fælled Skole",11
"Lærere til Heerup Skole – en specialskole for elever med vidtgående generelle udviklingsforstyrrelser",11
"Lærere til skoleåret 21-22 på Skolen i Nordøstamager",11
"Ungdomsskolen søger en uddannelsesvejleder til Byhøjskolen",11
"To lærere med erfaring indenfor specialpædagogik og -didaktik til specialklasserækken på Dyvekeskolen",11
"Matematiklærer til 2022 på Tagensbo Skole",11
"Ambitiøse og nytænkende lærere til basisskole og udskoling i Skolen på Islands Brygge",11
"Tove Ditlevsens Skole søger tre lærere til kommende skoleår 2021/22",11
"Dygtige og engagerede konsulenter til Jobcenter København",11
"Dansk-, musik- og engelsklærer til mellemtrinnet på Sortedamskolen (barselsvikariat)",11
"Brønshøj Skole søger en dansklærer i et barselsvikariat til kommende 2. årgang",11
"Fagligt ambitiøs afdelingsleder til udskoling på Peder Lykke Skolen",11
"Rungsted Skole søger ambitiøs lærer med linjefag i dansk til indskolingen",11
"Kørelærer søges",11
"Sagsbehandler-vikar til a-kassens Ydelsesteam i Fødevareforbundet NNF’s a-kasse",11
"Mørdrupskolen søger to didaktiske stjerner",11
"Engagerede og udviklingsorienterede lærere til Skolen ved Bülowsvej",11
"Ungdomsskolen søger fritidsundervisere til sæsonen 2021-22",11
"Skolen ved Gurrevej søger en børnehaveklasseleder",11
"To lærere til Helsingør kommunes specialskole for elever med ADHD.",11
Institutionsleder,11
"CareCompagniet søger lige nu en socialfaglig koordinator til deltidsstiling",11
"Lærer til Gentofte Kommunes 10. klassecenter",11
"Udskolingslærer til Dyssegårdsskolen",11
"Lærere til Skovgårdsskolen",11
"Børnehaveklasseleder til Dyssegårdsskolen i Gentofte",11
"Gentofte Ungdomsskole søger pr. 1. august 2021 en lærer til skoletilbud for unge som er i skolevægring.",11
"Trainee-stilling på Munkegårdsskolen i Gentofte",11
"Trainee-stillinger på Skovshoved Skole i Gentofte",11
"Gentofte Ungdomsskole søger uddannede lærere til udvidelse af Loftet, som er en gruppeordning for unge inden for autismespektret",11
"Trainee-stilling på Gentofte Skole",11
"Trainee til Dyssegårdsskolen",11
"Sagsbehandler til sygedagpenge og jobafklaring søges",11
"Trainee til Maglegårdsskolen",11
"Virksomhedskonsulent og vejleder til ngo søges",11
"Talehøresprog konsulent til Det rådgivende team - vikariat",11
"Løse vikarer søges til Specialcenter Marielundskolen og Børnehus",11
"Kolding HF & VUC søger undervisere til matematik A og B",11
"Bjerregrav Friskole søger to lærere med pondus til midtjyllands fedeste job....",11
"Bjerregrav Friskole søger to lærere med pondus til midtjyllands fedeste job....",11
Læsevejleder,11
"Kan du sige ja til: Faglærer til entreprenør- og landbrugsmaskinuddannelserne",11
"Tre nye handelslærer til EUD/EUX Business",11
"CKA/Jobcenter Vesthimmerland søger erfaren virksomhedskonsulent til det forsikrede / kontanthjælps området",11
"Virksomhedskonsulent til Fleksjob i Jobcenter Vesthimmerland",11
"Lærer - der kan noget med musik og indskoling",11
"SOSU Nord søger læsevejleder/SPS-lærer/elevrådgiver til Aars og Hobro (fastansættelse)",11
"Brænder du for at undervise?",11
"Uddannelsesagent til Jobcenter Vejle",11
"Tysk- og indskolingslærere Sdr. Bjert Centralskole",11
"Lærer til Sebber skole",11
"Lærer til Smidstrup-Skærup Skole",11
"Lærer til specialskole",11
"Lærere til Ullerup Bæk Skolen afdeling Nørre Allé",11
"Lærer til specialskolen Frederiksodde Skole, Autismeafdelingen",11
"2 lærerstillinger – en dansklærer i indskolingen og en naturfagslærer i udskolingen på Fjordbakkeskolen",11
"Lærer til udskolingen på Erritsø Fællesskole – afd. Bygaden",11
"Musiklærer til Ullerup Bæk Skolen, afdeling Skolesvinget",11
"2 Lærestillinger til specialskolen Frederiksodde Skole, afdeling C og D",11
"Lærer til Fårvang Skole",11
"Barselsvikar søges til lærerstilling på Sønderholm Skole",11
"Spændende fuldtids-lærerstilling på Østbirk skole",11
"Uddannelseschef med stærke personale- og ledelsesmæssige kompetencer",11
"Deutsche Schule Sonderburg søger en lærer",11
"Fagærer inden for energiteknisk område til EUC Syd i Tønder",11
"Lærer - 37 timer til Øster Hornum Børneunivers",11
"Matematik- og fysik/kemilærer til Lillebæltskolen (genopslag)",11
"Lysabild Børneunivers søger en tysk- og matematiklærer",11
"Lærere til Bankagerskolen - Udskolingen",11
"Vi søger erfarne lærere, som er stærke eksperter i klasserumsledelse",11
"HORSENS BYSKOLE søger endnu en dygtig læsevejleder",11
"Lærer søges pr. 1/8-2021 til Hulvej Privatskole",11
"Synskonsulent søges til skole- og voksenområdet",11
"Uddannelsesvejleder til specialområdet - Ungecentret",11
"Kørelærere søges til både Aarhus, Hjørring og Aalborg",11
"Lærer til håndbold og engelsk",11
"Solsideskolen søger fast lærer",11
"SOSU Nord søger 2 rekrutterings- og efteruddannelseskonsulenter til KURSUS Nord",11
"SOSU Nord søger SPS-lærer/underviser på GF1 i Aalborg (fastansættelse)",11
"SOSU Nord søger sundhedsfaglige medarbejdere til jobrotationsvikariater i Aalborg",11
"SOSU Nord søger 2 læsevejledere/FVU-lærere til Aalborg (fastansættelse)",11
"SOSU Nord søger SPS-lærer til Aalborg (fastansættelse)",11
"Undervisere til AOF Nordjyllands Aftenskole i Rebild Kommune",11
"Undervisere til AOF Nordjyllands Aftenskole i Frederikshavn Kommune",11
"AOF Nordjyllands Aftenskoler søger undervisere til AOF Aftenskolen i Thisted",11
"Undervisere til AOF Nordjyllands Aftenskole i Mariagerfjord Kommune",11
"Undervisere til AOF Nordjyllands Aftenskole i Jammerbugt Kommune",11
"AOF Nordjyllands Aftenskole i Aalborg søger undervisere",11
Børnehaveklasseleder,11
"Vi søger speciallærer",11
"Vi søger ny udskolingslærer",11
"Pædagogisk leder børnehaven Fantasia",11
"37 timers lærer til skoledelen fra den 1. august 2021",11
"Hovedgård skole søger en dygtig dansk og naturfagslærer til vikariat i udskolingen",11
"Hovedgård skole søger en dygtig dansk og tysklærer til en fast stilling.",11
"Matematiklærer i yngste afdeling søges",11
"Vi søger koordinator og idrætslærer på Herningvej Skole",11
"Faglig sagsbehandler - Arbejdsskade området",11
"Gistrup Skole søger lærere til mellemtrinnet",11
"Motiverende faglærer til grundforløb 1 – hos Tradium",11
"Lærere til Præstemarkskolen i Søften",11
"Personlig jobformidler til Udviklingshuset, Jobcenter Randers",11
"Jobkonsulent til UUR, Jobcenter Randers",11
"Romalt Friskole søger lærer",11
"Underviser, jobkonsulent og mentor til Center for Vejledning og Afklaring, Jobcenter Favrskov",11
"Pædagogisk personale til LCH",11
"Underviser i dansk som andetsprog søges til asylskole for voksne asylansøgere",11
"Aarhus HF og VUC søger undervisere til HF/GS-afdelingen fra august 2021",11
"1 JOBKONSULENT TIL AFDELINGEN FOR JOBPARATE KONTANTHJÆLPSMODTAGERE OVER 30 ÅR - CENTER FOR VIRKSOMHEDSSERVICE & JOBINDSATSER",11
"Indskolingslærer med et hjerte for trivsel og faglighed - med matematik",11
"Lærer med et hjerte for trivsel og faglighed - Til vores mellemtrin",11
"Indskolingslærer med et hjerte for trivsel og faglighed",11
"Vendsyssel NaturUnivers søger naturfagslærer fra august 2021",11
"Hornslet Skole søger en dygtig børnehaveklasseleder",11
"Hornslet Skole søger en tysklærer, der også kan undervise i dansk i udskolingen.",11
"Lærere til Paarup Skoles Centerafdeling",11
"Lærer til Sygehusundervisningen på OUH",11
"Lærere til CSV Voksenspecialundervisning",11
"Lærer til Søhusskolens mellemtrin og udskoling",11
"Lærer på Søhusskolen - Barselsvikariat",11
"Lærere til Dalumskolens særlige tilbud",11
"HF & VUC FYN søger lærere til hf.",11
"AVU- lærere til bl.a. matematik, engelsk og naturfag på HF og VUC FYN, Odense.",11
"Køreskole søger kollega",11
"Mejeriafdelingen på Kold College søger 2 ambitiøse faglærere",11
"Dansklærer til Ejerslykkeskolen",11
"Undervisere til blikkenslager og VVS-montør-uddannelsen",11
"Undervisere til Grundforløb 1 og Brobygning – Byggeri og Industri",11
"Undervisere til dansk og engelsk på erhvervsuddannelser/EUX og SPS",11
"Dygtig og engageret lærer søges til udskolingen i specialafdelingen på Tingagerskolen",11
"Marienhoffskolen søger lærer med specialpædagogiske kompetencer og erfaringer til fast stilling 1. august 2021",11
"Dedikeret grundforløbsunderviser til EUC Nord",11
"Friskolelærere til Sæby Friskole Vær&Lær",11
Lærer,11
"SOSU Nord søger læsevejleder/SPS-lærer/elevrådgiver til Frederikshavn og Brovst (fastansættelse)",11
"Lærer til Landsbyordning Tre Ege Skolen, afd. Kværndrup",11
"Underviser dansk og engelsk",11
"Ambitiøse børnehaveklasseledere, der brænder for 0. årgang på Tåsingeskolen",11
"Musiklærer søges til Stokkebækskolen",11
"Vestre Skole søger dansk og matematik lærer til 1.årgang",11
"Ambitiøs lærer til Tåsingeskolen, der brænder for fagene dansk og tysk og for at skabe væredygtige unge mennesker",11
"Ambitiøs lærer der brænder for at gøre en forskel for elever med socio-emotionelle udfordringer søges til Tåsingeskolen",11
"Ørkildskolen søger lærer til specialopgave i indskolingen",11
"Dansklærer til børnemiljøet på Tåsingeskolen",11
"Undervisningen på Grenen søger tilkaldevikarer",11
"Tysklærer og Fransklærer til udskolingen søges",11
"Outdoor- og naturfagslærer søges til Stokkebækskolen",11
"Tilkaldevikarer til skole og SFO",11
"2 fængselslærere til Institution Nyborg, Nyborg Fængsel",11
"Søren Kanne-skolen søger tre lærere til afd. Vestre",11
"Musiklærer til Allingåbro",11
"VID detail søger skarpe undervisere til lederuddannelse indenfor detailhandel",11
Afdelingskoordinator,11
"FGU-lærer, Mad og ernæring",11
"Musiklærer til Baggesenskolen",11
"DSA lærer til Tårnborg Skole pr. 1. august",11
"Sagsbehandler til kystbeskyttelsessager",11
"Lærer søges til Søllested Landsbyordning",11
"Vi søger en engageret lærer til Den Interne Skole",11
"Lærer til Nymarkskolen",11
"Flakkebjerg Skole søger dansklærer samt barselsvikar",11
"Lærer til Stillinge Skole",11
"Skolekontaktperson til udviklingsprojekt",11
"Jobkonsulent til området for ressourceforløb",11
"Barselsvikariater til Nymarkskolen",11
"Lærer til Rødby Skole (Barselsvikariat)",11
"Tre lærere til Rødby Skole",11
